{
  "id": "route-quest-mm",
  "name": "Monkey Madness I \u2014 Requirements Route",
  "description": "Optimised prerequisite route for Monkey Madness I, generated by the progression-router planner.",
  "steps": [
    {
      "id": "train-attack-10",
      "instruction": "Train Attack 1\u219210",
      "detail": "Chickens in Lumbridge. No food needed, fast kills.",
      "highlights": [
        {
          "type": "NPC",
          "id": 1173
        }
      ],
      "mapMarkers": [
        {
          "x": 3235,
          "y": 3295,
          "plane": 0,
          "label": "Lumbridge chickens"
        }
      ],
      "completionConditions": [
        {
          "type": "SKILL",
          "skill": "ATTACK",
          "level": 10
        }
      ]
    },
    {
      "id": "train-defence-10",
      "instruction": "Train Defence 1\u219210",
      "detail": "Chickens or crabs. Passive Defence XP from combat.",
      "highlights": [
        {
          "type": "NPC",
          "id": 1173
        }
      ],
      "mapMarkers": [
        {
          "x": 3235,
          "y": 3295,
          "plane": 0,
          "label": "Lumbridge chickens"
        }
      ],
      "completionConditions": [
        {
          "type": "SKILL",
          "skill": "DEFENCE",
          "level": 10
        }
      ]
    },
    {
      "id": "train-attack-30",
      "instruction": "Train Attack 10\u219230",
      "detail": "Cows east of Lumbridge or goblins. Drop bones for Prayer XP.",
      "highlights": [
        {
          "type": "NPC",
          "id": 397
        }
      ],
      "mapMarkers": [
        {
          "x": 3259,
          "y": 3266,
          "plane": 0,
          "label": "Lumbridge cows"
        }
      ],
      "completionConditions": [
        {
          "type": "SKILL",
          "skill": "ATTACK",
          "level": 30
        }
      ]
    },
    {
      "id": "train-defence-30",
      "instruction": "Train Defence 10\u219230",
      "detail": "Goblins or cows.",
      "highlights": [
        {
          "type": "NPC",
          "id": 397
        }
      ],
      "mapMarkers": [
        {
          "x": 3259,
          "y": 3266,
          "plane": 0,
          "label": "Lumbridge cows"
        }
      ],
      "completionConditions": [
        {
          "type": "SKILL",
          "skill": "DEFENCE",
          "level": 30
        }
      ]
    },
    {
      "id": "train-attack-40",
      "instruction": "Train Attack 30\u219240",
      "detail": "Barbarians south of Edgeville. Equips steel weapons.",
      "highlights": [
        {
          "type": "NPC",
          "id": 3103
        }
      ],
      "mapMarkers": [
        {
          "x": 3081,
          "y": 3420,
          "plane": 0,
          "label": "Barbarian Village"
        }
      ],
      "completionConditions": [
        {
          "type": "SKILL",
          "skill": "ATTACK",
          "level": 40
        }
      ]
    },
    {
      "id": "train-defence-40",
      "instruction": "Train Defence 30\u219240",
      "detail": "Barbarians or Stronghold. Unlocks rune armour.",
      "highlights": [
        {
          "type": "NPC",
          "id": 3103
        }
      ],
      "mapMarkers": [
        {
          "x": 3081,
          "y": 3420,
          "plane": 0,
          "label": "Barbarian Village"
        }
      ],
      "completionConditions": [
        {
          "type": "SKILL",
          "skill": "DEFENCE",
          "level": 40
        }
      ]
    },
    {
      "id": "synth-attack-43-1",
      "instruction": "Train Attack 40\u219243",
      "detail": "Synthetic step \u2014 no matching step found in bank.",
      "highlights": [],
      "mapMarkers": [],
      "completionConditions": [
        {
          "type": "SKILL",
          "skill": "ATTACK",
          "level": 43
        }
      ]
    },
    {
      "id": "synth-defence-43-2",
      "instruction": "Train Defence 40\u219243",
      "detail": "Synthetic step \u2014 no matching step found in bank.",
      "highlights": [],
      "mapMarkers": [],
      "completionConditions": [
        {
          "type": "SKILL",
          "skill": "DEFENCE",
          "level": 43
        }
      ]
    },
    {
      "id": "capstone-quest-mm",
      "instruction": "You now meet the requirements for Monkey Madness I.",
      "detail": "All prerequisite skills are trained \u2014 you can start this goal.",
      "highlights": [],
      "mapMarkers": [],
      "completionConditions": [
        {
          "type": "SKILL",
          "skill": "ATTACK",
          "level": 43
        },
        {
          "type": "SKILL",
          "skill": "DEFENCE",
          "level": 43
        }
      ]
    }
  ]
}